URL,Version,Status,OIDs,Name,Title,Description,Uses,Used,Sources
http://hl7.org/fhir/ValueSet/audit-entity-type,4.0.1,draft,"2.16.840.1.113883.4.642.3.458",AuditEventEntityType,Audit event entity type,"Code for the entity type involved in the audit event.","StructureDefinition/eflow-rx-auditevent","THO,hl7.fhir.r4.core"
http://hl7.org/fhir/ValueSet/audit-event-action,4.0.1,draft,"2.16.840.1.113883.4.642.3.452",AuditEventAction,AuditEventAction,"Indicator for type of action performed during the event that generated the event.","StructureDefinition/eflow-rx-auditevent","hl7.fhir.uv.xver-r5.r4"
http://hl7.org/fhir/ValueSet/audit-event-outcome,4.0.1,draft,"2.16.840.1.113883.4.642.3.454",AuditEventOutcome,AuditEventOutcome,"Indicates whether the event succeeded or failed.","StructureDefinition/eflow-rx-auditevent","hl7.fhir.r4.core"
http://hl7.org/fhir/ValueSet/audit-event-sub-type,4.0.1,active,"2.16.840.1.113883.4.642.3.464",AuditEventSub-Type,Audit Event Sub-Type,"More detailed code concerning the type of the audit event - defined by DICOM with some FHIR specific additions.","StructureDefinition/eflow-rx-auditevent","DICOM,hl7.fhir.uv.xver-r5.r4"
http://hl7.org/fhir/ValueSet/audit-event-type,4.0.1,active,"2.16.840.1.113883.4.642.3.462",AuditEventID,Audit Event ID,"Event Types for Audit Events - defined by DICOM with some FHIR specific additions.","StructureDefinition/eflow-rx-auditevent","THO,DICOM"
http://hl7.org/fhir/ValueSet/audit-source-type,4.0.1,active,"2.16.840.1.113883.4.642.3.466",AuditEventSourceType,Audit Event Source Type,"The type of process where the audit event originated from.","StructureDefinition/eflow-rx-auditevent","THO"
http://hl7.org/fhir/ValueSet/bundle-type,4.0.1,active,"2.16.840.1.113883.4.642.3.620",BundleType,BundleType,"Indicates the purpose of a bundle - how it is intended to be used.","StructureDefinition/eflow-rx-bundle-op-accept,StructureDefinition/eflow-rx-bundle","hl7.fhir.uv.xver-r5.r4"
http://hl7.org/fhir/ValueSet/clinical-findings,4.0.1,draft,"2.16.840.1.113883.4.642.3.232",SNOMEDCTClinicalFindings,SNOMED CT Clinical Findings,"This value set includes all the ""Clinical finding"" [SNOMED CT](http://snomed.info/sct) codes - concepts where concept is-a 404684003 (Clinical finding (finding)).","StructureDefinition/eflow-rx-communication-dispreq,StructureDefinition/eflow-rx-communication,StructureDefinition/eflow-rx-communication-representative,StructureDefinition/eflow-rx-communication-reply","SCT"
http://hl7.org/fhir/ValueSet/common-tags,4.0.1,draft,"2.16.840.1.113883.4.642.3.79",CommonTags,Common Tags,"Common Tag Codes defined by FHIR project","StructureDefinition/eflow-rx-medicationdispense,StructureDefinition/eflow-rx-medication","THO"
http://hl7.org/fhir/ValueSet/communication-category,4.0.1,draft,"2.16.840.1.113883.4.642.3.172",CommunicationCategory,CommunicationCategory,"Codes for general categories of communications such as alerts, instructions, etc.","StructureDefinition/eflow-rx-communication-dispreq,StructureDefinition/eflow-rx-communication,StructureDefinition/eflow-rx-communication-representative,StructureDefinition/eflow-rx-communication-reply","THO"
http://hl7.org/fhir/ValueSet/communication-not-done-reason,4.0.1,draft,"2.16.840.1.113883.4.642.3.174",CommunicationNotDoneReason,CommunicationNotDoneReason,"Codes for the reason why a communication did not happen.","StructureDefinition/eflow-rx-communication-dispreq,StructureDefinition/eflow-rx-communication,StructureDefinition/eflow-rx-communication-representative,StructureDefinition/eflow-rx-communication-reply","THO"
http://hl7.org/fhir/ValueSet/communication-topic,4.0.1,draft,"2.16.840.1.113883.4.642.3.983",CommunicationTopic,CommunicationTopic,"Codes describing the purpose or content of the communication.","StructureDefinition/eflow-rx-communication-dispreq,StructureDefinition/eflow-rx-communication,StructureDefinition/eflow-rx-communication-representative,StructureDefinition/eflow-rx-communication-reply","THO"
http://hl7.org/fhir/ValueSet/composition-attestation-mode,4.0.1,draft,"2.16.840.1.113883.4.642.3.238",CompositionAttestationMode,CompositionAttestationMode,"The way in which a person authenticated a composition.","StructureDefinition/eflow-rx-composition","hl7.fhir.uv.xver-r5.r4"
http://hl7.org/fhir/ValueSet/composition-status,4.0.1,draft,"2.16.840.1.113883.4.642.3.241",CompositionStatus,CompositionStatus,"The workflow/clinical status of the composition.","StructureDefinition/eflow-rx-composition","hl7.fhir.uv.xver-r5.r4"
http://hl7.org/fhir/ValueSet/device-nametype,4.0.1,draft,"2.16.840.1.113883.4.642.3.1083",DeviceNameType,DeviceNameType,"The type of name the device is referred by.","StructureDefinition/eflow-rx-device","hl7.fhir.uv.xver-r5.r4"
http://hl7.org/fhir/ValueSet/device-status,4.0.1,draft,"2.16.840.1.113883.4.642.3.209",FHIRDeviceStatus,FHIRDeviceStatus,"The availability status of the device.","StructureDefinition/eflow-rx-device","hl7.fhir.uv.xver-r5.r4"
http://hl7.org/fhir/ValueSet/device-status-reason,4.0.1,draft,"2.16.840.1.113883.4.642.3.1081",FHIRDeviceStatusReason,FHIRDeviceStatusReason,"The availability status reason of the device.","StructureDefinition/eflow-rx-device","THO"
http://hl7.org/fhir/ValueSet/device-type,4.0.1,draft,"2.16.840.1.113883.4.642.3.1376",DeviceType,Device Type,"Codes used to identify medical devices. Includes concepts from SNOMED CT (http://www.snomed.org/) where concept is-a 49062001 (Device)  and is provided as a suggestive example.","StructureDefinition/eflow-rx-device","SCT"
http://hl7.org/fhir/ValueSet/dicm-405-mediatype,4.0.1,active,"1.2.840.10008.6.​1.​908",MediaTypeCode,Media Type Code,"Media Type Code","StructureDefinition/eflow-rx-auditevent","DICOM"
http://hl7.org/fhir/ValueSet/doc-section-codes,4.0.1,draft,"2.16.840.1.113883.4.642.3.237",DocumentSectionCodes,Document Section Codes,"Document section codes (LOINC codes used in CCDA sections).","StructureDefinition/eflow-rx-composition","LOINC"
http://hl7.org/fhir/ValueSet/doc-typecodes,4.0.1,draft,"2.16.840.1.113883.4.642.3.240",FHIRDocumentTypeCodes,FHIR Document Type Codes,"FHIR Document Codes - all LOINC codes where scale type = 'DOC'.","StructureDefinition/eflow-rx-composition","LOINC"
http://hl7.org/fhir/ValueSet/document-classcodes,4.0.1,active,"2.16.840.1.113883.3.88.12.80.46",DocumentClassValueSet,Document Class Value Set,"This is the code specifying the high-level kind of document (e.g. Prescription, Discharge Summary, Report, etc.). Note: Class code for documents comes from LOINC, and is based upon one of the following:The type of service described by the document. It is described at a very high level in Section 7.3 of the LOINC Manual. The type study performed. It was determined by identifying modalities for study reports. The section of the chart where the document is placed. It was determined from the SETs created for Claims Attachment requests.","StructureDefinition/eflow-rx-composition","LOINC"
http://hl7.org/fhir/ValueSet/document-relationship-type,4.0.1,draft,"2.16.840.1.113883.4.642.3.244",DocumentRelationshipType,DocumentRelationshipType,"The type of relationship between documents.","StructureDefinition/eflow-rx-composition","hl7.fhir.uv.xver-r5.r4"
http://hl7.org/fhir/ValueSet/event-status,4.0.1,draft,"2.16.840.1.113883.4.642.3.109",EventStatus,EventStatus,"Codes identifying the lifecycle stage of an event.","StructureDefinition/eflow-rx-communication-dispreq,StructureDefinition/eflow-rx-communication,StructureDefinition/eflow-rx-communication-representative,StructureDefinition/eflow-rx-communication-reply","hl7.fhir.uv.xver-r5.r4"
http://hl7.org/fhir/ValueSet/http-verb,4.0.1,active,"2.16.840.1.113883.4.642.3.624",HTTPVerb,HTTPVerb,"HTTP verbs (in the HTTP command line). See [HTTP rfc](https://tools.ietf.org/html/rfc7231) for details.","StructureDefinition/eflow-rx-bundle-op-accept,StructureDefinition/eflow-rx-bundle","hl7.fhir.uv.xver-r5.r4"
http://hl7.org/fhir/ValueSet/identifier-type,4.0.1,active,"2.16.840.1.113883.4.642.3.45",Identifier Type Codes,IdentifierType,"A coded type for an identifier that can be used to determine which identifier to use for a specific purpose.","StructureDefinition/eflow-rx-task,StructureDefinition/eflow-rx-secret,StructureDefinition/eflow-rx-accesscode","THO (V2)"
http://hl7.org/fhir/ValueSet/identifier-use,4.0.1,active,"2.16.840.1.113883.4.642.3.57",IdentifierUse,IdentifierUse,"Identifies the purpose for this identifier, if known .","StructureDefinition/eflow-rx-task,StructureDefinition/eflow-rx-secret,StructureDefinition/eflow-rx-accesscode","hl7.fhir.uv.xver-r5.r4"
http://hl7.org/fhir/ValueSet/issue-severity,4.0.1,active,"2.16.840.1.113883.4.642.3.408",IssueSeverity,IssueSeverity,"How the issue affects the success of the action.","StructureDefinition/eflow-rx-operationoutcome","hl7.fhir.uv.xver-r5.r4"
http://hl7.org/fhir/ValueSet/issue-type,4.0.1,active,"2.16.840.1.113883.4.642.3.410",IssueType,IssueType,"A code that describes the type of issue.","StructureDefinition/eflow-rx-operationoutcome","hl7.fhir.uv.xver-r5.r4"
http://hl7.org/fhir/ValueSet/languages,4.0.1,draft,"2.16.840.1.113883.4.642.3.20",CommonLanguages,Common Languages,"This value set includes common codes from BCP-47 (http://tools.ietf.org/html/bcp47)","StructureDefinition/eflow-rx-communication-dispreq,StructureDefinition/eflow-rx-close-operation-output-parameters,StructureDefinition/eflow-rx-medicationdispense,StructureDefinition/eflow-rx-bundle,StructureDefinition/eflow-rx-task,StructureDefinition/eflow-rx-digest,StructureDefinition/eflow-rx-bundle-op-accept,StructureDefinition/eflow-rx-operationoutcome,StructureDefinition/eflow-rx-composition,StructureDefinition/eflow-rx-device,StructureDefinition/eflow-rx-accept-operation-output-parameters,StructureDefinition/eflow-rx-dispense-operation-input-parameters,StructureDefinition/eflow-rx-activate-operation-output-parameters,StructureDefinition/eflow-rx-communication,StructureDefinition/eflow-rx-close-operation-input-parameters,StructureDefinition/eflow-rx-communication-representative,StructureDefinition/eflow-rx-create-operation-output-parameters,StructureDefinition/eflow-rx-communication-reply,StructureDefinition/eflow-rx-auditevent,StructureDefinition/eflow-rx-binary,StructureDefinition/eflow-rx-medication","hl7.fhir.uv.xver-r5.r4"
http://hl7.org/fhir/ValueSet/list-empty-reason,4.0.1,draft,"2.16.840.1.113883.4.642.3.322",ListEmptyReasons,List Empty Reasons,"General reasons for a list to be empty. Reasons are either related to a summary list (i.e. problem or medication list) or to a workflow related list (i.e. consultation list).","StructureDefinition/eflow-rx-composition","THO"
http://hl7.org/fhir/ValueSet/list-mode,4.0.1,draft,"2.16.840.1.113883.4.642.3.318",ListMode,ListMode,"The processing mode that applies to this list.","StructureDefinition/eflow-rx-composition","hl7.fhir.uv.xver-r5.r4"
http://hl7.org/fhir/ValueSet/list-order,4.0.1,draft,"2.16.840.1.113883.4.642.3.324",ListOrderCodes,List Order Codes,"Base values for the order of the items in a list resource.","StructureDefinition/eflow-rx-composition","THO"
http://hl7.org/fhir/ValueSet/medication-codes,4.0.1,draft,"2.16.840.1.113883.4.642.3.375",SNOMEDCTMedicationCodes,SNOMED CT Medication Codes,"This value set includes all drug or medicament substance codes and all pharmaceutical/biologic products from SNOMED CT - provided as an exemplar value set.","StructureDefinition/eflow-rx-medication","SCT"
http://hl7.org/fhir/ValueSet/medication-form-codes,4.0.1,draft,"2.16.840.1.113883.4.642.3.374",SNOMEDCTFormCodes,SNOMED CT Form Codes,"This value set includes all dose form codes from SNOMED CT - provided as an exemplar.","StructureDefinition/eflow-rx-medication","SCT"
http://hl7.org/fhir/ValueSet/medication-status,4.0.1,draft,"2.16.840.1.113883.4.642.3.376",Medication Status Codes,Medication  status  codes,"Medication Status Codes","StructureDefinition/eflow-rx-medication","hl7.fhir.uv.xver-r5.r4"
http://hl7.org/fhir/ValueSet/medicationdispense-performer-function,4.0.1,draft,"2.16.840.1.113883.4.642.3.1318",MedicationDispense Performer Function Codes,Medication dispense  performer  function  codes,"MedicationDispense Performer Function Codes","StructureDefinition/eflow-rx-medicationdispense","THO"
http://hl7.org/fhir/ValueSet/medicationdispense-status-reason,4.0.1,draft,"2.16.840.1.113883.4.642.3.1316",MedicationDispense Status Reason Codes,Medication dispense  status  reason  codes,"MedicationDispense Status Codes","StructureDefinition/eflow-rx-medicationdispense","THO"
http://hl7.org/fhir/ValueSet/mimetypes,4.0.1,active,"2.16.840.1.113883.4.642.3.1024",Mime Types,MimeType,"This value set includes all possible codes from BCP-13 (http://tools.ietf.org/html/bcp13)","StructureDefinition/eflow-rx-digest,StructureDefinition/eflow-rx-signature,StructureDefinition/eflow-rx-binary","Other"
http://hl7.org/fhir/ValueSet/network-type,4.0.1,draft,"2.16.840.1.113883.4.642.3.456",AuditEventAgentNetworkType,AuditEventAgentNetworkType,"The type of network access point of this agent in the audit event.","StructureDefinition/eflow-rx-auditevent","hl7.fhir.r4.core"
http://hl7.org/fhir/ValueSet/object-lifecycle-events,4.0.1,draft,,ObjectLifecycleEvents,,"This example FHIR value set is comprised of lifecycle event codes. The FHIR Actor value set is based on    DICOM Audit Message, ParticipantObjectDataLifeCycle;   ISO Standard, TS 21089-2017;  ","StructureDefinition/eflow-rx-auditevent","THO"
http://hl7.org/fhir/ValueSet/object-role,4.0.1,draft,"2.16.840.1.113883.4.642.3.460",AuditEventEntityRole,AuditEventEntityRole,"Code representing the role the entity played in the audit event.","StructureDefinition/eflow-rx-auditevent","THO"
http://hl7.org/fhir/ValueSet/participation-role-type,4.0.1,draft,"2.16.840.1.113883.4.642.3.54",ParticipationRoleType,ParticipationRoleType,"This FHIR value set is comprised of Actor participation Type codes, which can be used to value FHIR agents, actors, and other role         elements. The FHIR Actor participation type value set is based on    DICOM Audit Message, C402;   ASTM Standard, E1762-95 [2013]; selected codes and          derived actor roles from HL7 RoleClass OID 2.16.840.1.113883.5.110;    HL7 Role Code 2.16.840.1.113883.5.111, including AgentRoleType;          HL7 ParticipationType OID: 2.16.840.1.113883.5.90; and    HL7 ParticipationFunction codes OID: 2.16.840.1.113883.5.88.           This value set includes, by reference, role codes from external code systems: NUCC Health Care Provider Taxonomy OID: 2.16.840.1.113883.6.101;          North American Industry Classification System [NAICS]OID: 2.16.840.1.113883.6.85; IndustryClassificationSystem 2.16.840.1.113883.1.11.16039;          and US Census Occupation Code OID: 2.16.840.1.113883.6.243 for relevant recipient or custodian codes not included in this value set.            If no source is indicated in the definition comments, then these are example FHIR codes.","StructureDefinition/eflow-rx-auditevent","THO (V3),THO,DICOM"
http://hl7.org/fhir/ValueSet/performer-role,4.0.1,draft,"2.16.840.1.113883.4.642.3.433",ProcedurePerformerRoleCodes,Procedure Performer Role Codes,"This example value set defines the set of codes that can be used to indicate a role of a procedure performer.","StructureDefinition/eflow-rx-task","SCT"
http://hl7.org/fhir/ValueSet/quantity-comparator,4.0.1,active,"2.16.840.1.113883.4.642.3.59",QuantityComparator,QuantityComparator,"How the Quantity should be understood and represented.","StructureDefinition/eflow-rx-medication","hl7.fhir.uv.xver-r5.r4"
http://hl7.org/fhir/ValueSet/request-priority,4.0.1,draft,"2.16.840.1.113883.4.642.3.115",RequestPriority,Request priority,"The clinical priority of a diagnostic order.","StructureDefinition/eflow-rx-communication-dispreq,StructureDefinition/eflow-rx-task,StructureDefinition/eflow-rx-communication,StructureDefinition/eflow-rx-communication-representative,StructureDefinition/eflow-rx-communication-reply","hl7.fhir.uv.xver-r5.r4"
http://hl7.org/fhir/ValueSet/resource-types,4.0.1,active,"2.16.840.1.113883.4.642.3.27",ResourceType,ResourceType,"One of the resource types defined as part of this version of FHIR.","StructureDefinition/eflow-rx-communication-dispreq,StructureDefinition/eflow-rx-composition,StructureDefinition/eflow-rx-medicationdispense,StructureDefinition/eflow-rx-task,StructureDefinition/eflow-rx-communication,StructureDefinition/eflow-rx-communication-representative,StructureDefinition/eflow-rx-signature,StructureDefinition/eflow-rx-communication-reply,StructureDefinition/eflow-rx-auditevent,StructureDefinition/eflow-rx-medication","hl7.fhir.r4.core"
http://hl7.org/fhir/ValueSet/search-entry-mode,4.0.1,active,"2.16.840.1.113883.4.642.3.622",SearchEntryMode,SearchEntryMode,"Why an entry is in the result set - whether it's included as a match or because of an _include requirement, or to convey information or warning information about the search process.","StructureDefinition/eflow-rx-bundle-op-accept,StructureDefinition/eflow-rx-bundle","hl7.fhir.uv.xver-r5.r4"
http://hl7.org/fhir/ValueSet/security-labels,4.0.1,active,"2.16.840.1.113883.4.642.3.47",All Security Labels,SecurityLabels,"A single value set for all security labels defined by FHIR.","StructureDefinition/eflow-rx-medicationdispense,StructureDefinition/eflow-rx-auditevent,StructureDefinition/eflow-rx-medication",
http://hl7.org/fhir/ValueSet/security-role-type,4.0.1,draft,"2.16.840.1.113883.4.642.3.978",SecurityRoleType,SecurityRoleType,"This example FHIR value set is comprised of example Actor Type codes, which can be used to value FHIR agents, actors, and other role         elements such as those specified in financial transactions. The FHIR Actor value set is based on    DICOM Audit Message, C402;   ASTM Standard, E1762-95 [2013]; selected codes and          derived actor roles from HL7 RoleClass OID 2.16.840.1.113883.5.110;    HL7 Role Code 2.16.840.1.113883.5.111, including AgentRoleType;          HL7 ParticipationType OID: 2.16.840.1.113883.5.90; and    HL7 ParticipationFunction codes OID: 2.16.840.1.113883.5.88.           This value set includes, by reference, role codes from external code systems: NUCC Health Care Provider Taxonomy OID: 2.16.840.1.113883.6.101;          North American Industry Classification System [NAICS]OID: 2.16.840.1.113883.6.85; IndustryClassificationSystem 2.16.840.1.113883.1.11.16039;          and US Census Occupation Code OID: 2.16.840.1.113883.6.243 for relevant recipient or custodian codes not included in this value set.            If no source is indicated in the definition comments, then these are example FHIR codes.          It can be extended with appropriate roles described by SNOMED as well as those described in the HL7 Role Based Access Control Catalog and the          HL7 Healthcare (Security and Privacy) Access Control Catalog.            In Role-Based Access Control (RBAC), permissions are operations on an object that a user wishes to access. Permissions are grouped into roles.          A role characterizes the functions a user is allowed to perform. Roles are assigned to users. If the user's role has the appropriate permissions          to access an object, then that user is granted access to the object. FHIR readily enables RBAC, as FHIR Resources are object types and the CRUDE          events (the FHIR equivalent to permissions in the RBAC scheme) are operations on those objects.          In Attribute-Based Access Control (ABAC), a user requests to perform operations on objects. That user's access request is granted or denied          based on a set of access control policies that are specified in terms of attributes and conditions. FHIR readily enables ABAC, as instances of          a Resource in FHIR (again, Resources are object types) can have attributes associated with them. These attributes include security tags,          environment conditions, and a host of user and object characteristics, which are the same attributes as those used in ABAC. Attributes help          define the access control policies that determine the operations a user may perform on a Resource (in FHIR) or object (in ABAC). For example,          a tag (or attribute) may specify that the identified Resource (object) is not to be further disclosed without explicit consent from the patient.","StructureDefinition/eflow-rx-auditevent","THO (V3),THO,DICOM"
http://hl7.org/fhir/ValueSet/signature-type,4.0.1,draft,"1.2.840.10065.1.12",SignatureTypeCodes,Signature Type Codes,"The Digital Signature Purposes, an indication of the reason an entity signs a document. This is included in the signed information and can be used when determining accountability for various actions concerning the document. Examples include: author, transcriptionist/recorder, and witness.","StructureDefinition/eflow-rx-signature","hl7.fhir.uv.xver-r5.r4"
http://hl7.org/fhir/ValueSet/task-code,4.0.1,active,"2.16.840.1.113883.4.642.3.1396",TaskCode,Task Codes,"Codes indicating the type of action that is expected to be performed","StructureDefinition/eflow-rx-task","hl7.fhir.uv.xver-r5.r4"
http://hl7.org/fhir/ValueSet/task-intent,4.0.1,draft,"2.16.840.1.113883.4.642.3.1240",TaskIntent,TaskIntent,"Distinguishes whether the task is a proposal, plan or full order.","StructureDefinition/eflow-rx-task","hl7.fhir.uv.xver-r5.r4"
http://hl7.org/fhir/ValueSet/task-status,4.0.1,draft,"2.16.840.1.113883.4.642.3.790",TaskStatus,TaskStatus,"The current status of the task.","StructureDefinition/eflow-rx-task","hl7.fhir.uv.xver-r5.r4"
http://hl7.org/fhir/ValueSet/ucum-units,4.0.1,draft,"2.16.840.1.113883.4.642.3.912",UCUMCodes,UCUM Codes,"Unified Code for Units of Measure (UCUM). This value set includes all UCUM codes","StructureDefinition/eflow-rx-medication","UCUM"
http://hl7.org/fhir/ValueSet/udi-entry-type,4.0.1,draft,"2.16.840.1.113883.4.642.3.211",UDIEntryType,UDIEntryType,"Codes to identify how UDI data was entered.","StructureDefinition/eflow-rx-device","hl7.fhir.uv.xver-r5.r4"
http://terminology.hl7.org/ValueSet/v3-ActCode,3.0.0,active,,ActCode,v3 Code System ActCode,"A code specifying the particular kind of Act that the Act-instance represents within its class.  Constraints:  The kind of Act (e.g. physical examination, serum potassium, inpatient encounter, charge financial transaction, etc.) is specified with a code from one of several, typically external, coding systems.  The coding system will depend on the class of Act, such as LOINC for observations, etc. Conceptually, the Act.code must be a specialization of the Act.classCode. This is why the structure of ActClass domain should be reflected in the superstructure of the ActCode domain and then individual codes or externally referenced vocabularies subordinated under these domains that reflect the ActClass structure. Act.classCode and Act.code are not modifiers of each other but the Act.code concept should really imply the Act.classCode concept. For a negative example, it is not appropriate to use an Act.code ""potassium"" together with and Act.classCode for ""laboratory observation"" to somehow mean ""potassium laboratory observation"" and then use the same Act.code for ""potassium"" together with Act.classCode for ""medication"" to mean ""substitution of potassium"". This mutually modifying use of Act.code and Act.classCode is not permitted.","StructureDefinition/eflow-rx-composition","THO (V3)"
http://terminology.hl7.org/ValueSet/v3-ActPharmacySupplyType,3.0.0,active,"2.16.840.1.113883.1.11.16208",ActPharmacySupplyType,ActPharmacySupplyType,"Identifies types of dispensing events","StructureDefinition/eflow-rx-medicationdispense","THO (V3)"
http://terminology.hl7.org/ValueSet/v3-ActSubstanceAdminSubstitutionCode,3.0.0,active,"2.16.840.1.113883.1.11.16621",ActSubstanceAdminSubstitutionCode,ActSubstanceAdminSubstitutionCode,"***No description***","StructureDefinition/eflow-rx-medicationdispense","THO (V3)"
http://terminology.hl7.org/ValueSet/v3-ConfidentialityClassification,2014-03-26,active,"2.16.840.1.113883.1.11.10228",v3.ConfidentialityClassification,V3 Value SetConfidentialityClassification," Set of codes used to value Act.Confidentiality and Role.Confidentiality attribute in accordance with the definition for concept domain ""Confidentiality"".","StructureDefinition/eflow-rx-composition","THO (V3)"
http://terminology.hl7.org/ValueSet/v3-ParticipationMode,3.0.0,active,"2.16.840.1.113883.1.11.16543",ParticipationMode,ParticipationMode,"Identifies the primary means by which an Entity participates in an Act.","StructureDefinition/eflow-rx-communication-dispreq,StructureDefinition/eflow-rx-communication,StructureDefinition/eflow-rx-communication-representative,StructureDefinition/eflow-rx-communication-reply","THO (V3)"
http://terminology.hl7.org/ValueSet/v3-PurposeOfUse,3.1.0,active,"2.16.840.1.113883.1.11.20448",PurposeOfUse,PurposeOfUse,"Supports communication of purpose of use at a general level.","StructureDefinition/eflow-rx-auditevent","THO (V3)"
http://terminology.hl7.org/ValueSet/v3-SubstanceAdminSubstitutionReason,3.0.0,active,"2.16.840.1.113883.1.11.19377",SubstanceAdminSubstitutionReason,SubstanceAdminSubstitutionReason,"***No description***","StructureDefinition/eflow-rx-medicationdispense","THO (V3)"
https://gematik.de/fhir/erp/ValueSet/eflow-rx-availabilitystatus,1.0.0-draft,draft,,EFlowRxAvailabilityStatusVS,ValueSet der Verfügbarkeitsstatus-Codes,"Art des Verfügbarkeitsstatus für die Verfügbarkeitsanfrage von Medikamenten","StructureDefinition/eflow-rx-availabilitystate-extension","Internal"
https://gematik.de/fhir/erp/ValueSet/eflow-rx-documenttype,1.0.0-draft,draft,,EFlowRxDocumentTypeVS,ValueSet der Dokumenttyp-Codes,"Art der Dokumente je nach Empfänger.","StructureDefinition/eflow-rx-composition,StructureDefinition/eflow-rx-task","Internal"
