URL,Version,Status,OIDs,Name,Title,Description,Uses,Used,Sources
https://gematik.de/fhir/erp/ValueSet/eflow-rx-flowtype,1.0.0-draft,draft,,EFlowRxFlowTypeVS,ValueSet der FlowType-Codes,"Zeigt die verschiedenen Arten des E-Rezepts entsprechend den Verschreibungsformularen.","StructureDefinition/eflow-rx-prescriptiontype-extension,OperationDefinition/CreateOperation","Internal"
https://gematik.de/fhir/erp/ValueSet/eflow-rx-operationoutcomedetails,1.0.0-draft,draft,,EFlowRxOperationOutcomeDetailsVS,GEM ERP VS OperationOutcomeDetails,"Fachliche Fehlercodes des E-Rezept-Fachdienst","StructureDefinition/eflow-rx-operationoutcome","Internal,THO,de.gematik.ti"
https://gematik.de/fhir/erp/ValueSet/eflow-rx-organizationtype,1.0.0-draft,draft,,EFlowRxOrganizationTypeVS,ValueSet der Organisationstyp-Codes,"Art der Organisation","StructureDefinition/eflow-rx-task","Internal"
https://gematik.de/fhir/terminology/ValueSet/ti-drug-category-vs,1.0.7,active,,TIDrugCategoryVS,TI Drug Category ValueSet,"The ValueSet for drug category.","StructureDefinition/eflow-rx-medication","de.gematik.terminology"
https://gematik.de/fhir/terminology/ValueSet/ti-medication-dispense-category-vs,1.0.7,active,,TIMedicationDispenseCategoryVS,TI Medication Dispense Category ValueSet,"Definiert den Kontext einer Abgabe: verschreibungspflichtig oder nicht verschreibungspflichtig","StructureDefinition/eflow-rx-medicationdispense","de.gematik.terminology"
https://gematik.de/fhir/terminology/ValueSet/ti-medication-dispense-status-vs,1.0.7,active,,TIMedicationDispenseStatusVS,TI Medication Dispense ValueSet,"TI Medication Dispense ValueSet","StructureDefinition/eflow-rx-medicationdispense","THO"
