URL,Version,Status,OIDs,Name,Title,Description,Uses,Used,Sources
http://hl7.org/fhir/ValueSet/signature-type,4.0.1,draft,"1.2.840.10065.1.12",SignatureTypeCodes,Signature Type Codes,"The Digital Signature Purposes, an indication of the reason an entity signs a document. This is included in the signed information and can be used when determining accountability for various actions concerning the document. Examples include: author, transcriptionist/recorder, and witness.","StructureDefinition/eflow-rx-signature","hl7.fhir.uv.xver-r5.r4"
https://gematik.de/fhir/erp/ValueSet/eflow-rx-availabilitystatus,1.0.0-draft,draft,,EFlowRxAvailabilityStatusVS,ValueSet der Verfügbarkeitsstatus-Codes,"Art des Verfügbarkeitsstatus für die Verfügbarkeitsanfrage von Medikamenten","StructureDefinition/eflow-rx-availabilitystate-extension","Internal"
https://gematik.de/fhir/erp/ValueSet/eflow-rx-documenttype,1.0.0-draft,draft,,EFlowRxDocumentTypeVS,ValueSet der Dokumenttyp-Codes,"Art der Dokumente je nach Empfänger.","StructureDefinition/eflow-rx-composition,StructureDefinition/eflow-rx-task","Internal"
https://gematik.de/fhir/erp/ValueSet/eflow-rx-flowtype,1.0.0-draft,draft,,EFlowRxFlowTypeVS,ValueSet der FlowType-Codes,"Zeigt die verschiedenen Arten des E-Rezepts entsprechend den Verschreibungsformularen.","StructureDefinition/eflow-rx-prescriptiontype-extension,OperationDefinition/CreateOperation","Internal"
https://gematik.de/fhir/erp/ValueSet/eflow-rx-operationoutcomedetails,1.0.0-draft,draft,,EFlowRxOperationOutcomeDetailsVS,GEM ERP VS OperationOutcomeDetails,"Fachliche Fehlercodes des E-Rezept-Fachdienst","StructureDefinition/eflow-rx-operationoutcome","Internal,THO,de.gematik.ti"
https://gematik.de/fhir/erp/ValueSet/eflow-rx-organizationtype,1.0.0-draft,draft,,EFlowRxOrganizationTypeVS,ValueSet der Organisationstyp-Codes,"Art der Organisation","StructureDefinition/eflow-rx-task","Internal"
