URL,Version,Status,OIDs,Name,Title,Description,Uses,Used,Sources
http://hl7.org/fhir/ValueSet/bundle-type,4.0.1,active,"2.16.840.1.113883.4.642.3.620",BundleType,BundleType,"Indicates the purpose of a bundle - how it is intended to be used.","StructureDefinition/tiflow-diga-receipt-bundle","hl7.fhir.r4.core"
http://hl7.org/fhir/ValueSet/clinical-findings,4.0.1,draft,"2.16.840.1.113883.4.642.3.232",SNOMEDCTClinicalFindings,SNOMED CT Clinical Findings,"This value set includes all the ""Clinical finding"" [SNOMED CT](http://snomed.info/sct) codes - concepts where concept is-a 404684003 (Clinical finding (finding)).","StructureDefinition/GEM-ERP-PR-Communication-DiGA","SCT"
http://hl7.org/fhir/ValueSet/common-tags,4.0.1,draft,"2.16.840.1.113883.4.642.3.79",CommonTags,Common Tags,"Common Tag Codes defined by FHIR project","StructureDefinition/GEM-ERP-PR-MedicationDispense-DiGA,StructureDefinition/tiflow-diga-task","THO"
http://hl7.org/fhir/ValueSet/communication-category,4.0.1,draft,"2.16.840.1.113883.4.642.3.172",CommunicationCategory,CommunicationCategory,"Codes for general categories of communications such as alerts, instructions, etc.","StructureDefinition/GEM-ERP-PR-Communication-DiGA","THO"
http://hl7.org/fhir/ValueSet/communication-not-done-reason,4.0.1,draft,"2.16.840.1.113883.4.642.3.174",CommunicationNotDoneReason,CommunicationNotDoneReason,"Codes for the reason why a communication did not happen.","StructureDefinition/GEM-ERP-PR-Communication-DiGA","THO"
http://hl7.org/fhir/ValueSet/communication-topic,4.0.1,draft,"2.16.840.1.113883.4.642.3.983",CommunicationTopic,CommunicationTopic,"Codes describing the purpose or content of the communication.","StructureDefinition/GEM-ERP-PR-Communication-DiGA","THO"
http://hl7.org/fhir/ValueSet/composition-attestation-mode,4.0.1,draft,"2.16.840.1.113883.4.642.3.238",CompositionAttestationMode,CompositionAttestationMode,"The way in which a person authenticated a composition.","StructureDefinition/tiflow-diga-receipt-composition","hl7.fhir.r4.core"
http://hl7.org/fhir/ValueSet/composition-status,4.0.1,draft,"2.16.840.1.113883.4.642.3.241",CompositionStatus,CompositionStatus,"The workflow/clinical status of the composition.","StructureDefinition/tiflow-diga-receipt-composition","hl7.fhir.r4.core"
http://hl7.org/fhir/ValueSet/data-absent-reason,4.0.1,active,"2.16.840.1.113883.4.642.3.5",DataAbsentReason,DataAbsentReason,"Used to specify why the normally expected content of the data element is missing.","StructureDefinition/GEM-ERP-PR-MedicationDispense-DiGA","THO"
http://hl7.org/fhir/ValueSet/doc-section-codes,4.0.1,draft,"2.16.840.1.113883.4.642.3.237",DocumentSectionCodes,Document Section Codes,"Document section codes (LOINC codes used in CCDA sections).","StructureDefinition/tiflow-diga-receipt-composition","LOINC"
http://hl7.org/fhir/ValueSet/doc-typecodes,4.0.1,draft,"2.16.840.1.113883.4.642.3.240",FHIRDocumentTypeCodes,FHIR Document Type Codes,"FHIR Document Codes - all LOINC codes where scale type = 'DOC'.","StructureDefinition/tiflow-diga-receipt-composition","LOINC"
http://hl7.org/fhir/ValueSet/document-classcodes,4.0.1,active,"2.16.840.1.113883.3.88.12.80.46",DocumentClassValueSet,Document Class Value Set,"This is the code specifying the high-level kind of document (e.g. Prescription, Discharge Summary, Report, etc.). Note: Class code for documents comes from LOINC, and is based upon one of the following:The type of service described by the document. It is described at a very high level in Section 7.3 of the LOINC Manual. The type study performed. It was determined by identifying modalities for study reports. The section of the chart where the document is placed. It was determined from the SETs created for Claims Attachment requests.","StructureDefinition/tiflow-diga-receipt-composition","LOINC"
http://hl7.org/fhir/ValueSet/document-relationship-type,4.0.1,draft,"2.16.840.1.113883.4.642.3.244",DocumentRelationshipType,DocumentRelationshipType,"The type of relationship between documents.","StructureDefinition/tiflow-diga-receipt-composition","hl7.fhir.r4.core"
http://hl7.org/fhir/ValueSet/event-status,4.0.1,draft,"2.16.840.1.113883.4.642.3.109",EventStatus,EventStatus,"Codes identifying the lifecycle stage of an event.","StructureDefinition/GEM-ERP-PR-Communication-DiGA","hl7.fhir.r4.core"
http://hl7.org/fhir/ValueSet/http-verb,4.0.1,active,"2.16.840.1.113883.4.642.3.624",HTTPVerb,HTTPVerb,"HTTP verbs (in the HTTP command line). See [HTTP rfc](https://tools.ietf.org/html/rfc7231) for details.","StructureDefinition/tiflow-diga-receipt-bundle","hl7.fhir.r4.core"
http://hl7.org/fhir/ValueSet/identifier-type,4.0.1,active,"2.16.840.1.113883.4.642.3.45",Identifier Type Codes,IdentifierType,"A coded type for an identifier that can be used to determine which identifier to use for a specific purpose.","StructureDefinition/GEM-ERP-PR-MedicationDispense-DiGA","THO (V2)"
http://hl7.org/fhir/ValueSet/identifier-use,4.0.1,active,"2.16.840.1.113883.4.642.3.57",IdentifierUse,IdentifierUse,"Identifies the purpose for this identifier, if known .","StructureDefinition/GEM-ERP-PR-MedicationDispense-DiGA","hl7.fhir.r4.core"
http://hl7.org/fhir/ValueSet/languages,4.0.1,draft,"2.16.840.1.113883.4.642.3.20",CommonLanguages,Common Languages,"This value set includes common codes from BCP-47 (http://tools.ietf.org/html/bcp47)","StructureDefinition/GEM-ERP-PR-Communication-DiGA,StructureDefinition/GEM-ERP-PR-MedicationDispense-DiGA,StructureDefinition/tiflow-diga-binary,StructureDefinition/tiflow-diga-receipt-bundle,StructureDefinition/tiflow-diga-receipt-composition,StructureDefinition/tiflow-diga-task,StructureDefinition/ti-flow-di-ga-create-operation-output,StructureDefinition/ti-flow-di-ga-create-operation-input,StructureDefinition/ti-flow-di-ga-activate-operation-input,StructureDefinition/ti-flow-di-ga-close-operation-output,StructureDefinition/ti-flow-di-ga-close-operation-input,StructureDefinition/ti-flow-di-ga-activate-operation-output,StructureDefinition/ti-flow-di-ga-accept-operation-output","hl7.fhir.uv.xver-r5.r4"
http://hl7.org/fhir/ValueSet/list-empty-reason,4.0.1,draft,"2.16.840.1.113883.4.642.3.322",ListEmptyReasons,List Empty Reasons,"General reasons for a list to be empty. Reasons are either related to a summary list (i.e. problem or medication list) or to a workflow related list (i.e. consultation list).","StructureDefinition/tiflow-diga-receipt-composition","THO"
http://hl7.org/fhir/ValueSet/list-mode,4.0.1,draft,"2.16.840.1.113883.4.642.3.318",ListMode,ListMode,"The processing mode that applies to this list.","StructureDefinition/tiflow-diga-receipt-composition","hl7.fhir.r4.core"
http://hl7.org/fhir/ValueSet/list-order,4.0.1,draft,"2.16.840.1.113883.4.642.3.324",ListOrderCodes,List Order Codes,"Base values for the order of the items in a list resource.","StructureDefinition/tiflow-diga-receipt-composition","THO"
http://hl7.org/fhir/ValueSet/medicationdispense-performer-function,4.0.1,draft,"2.16.840.1.113883.4.642.3.1318",MedicationDispense Performer Function Codes,Medication dispense  performer  function  codes,"MedicationDispense Performer Function Codes","StructureDefinition/GEM-ERP-PR-MedicationDispense-DiGA","THO"
http://hl7.org/fhir/ValueSet/medicationdispense-status-reason,4.0.1,draft,"2.16.840.1.113883.4.642.3.1316",MedicationDispense Status Reason Codes,Medication dispense  status  reason  codes,"MedicationDispense Status Codes","StructureDefinition/GEM-ERP-PR-MedicationDispense-DiGA","THO"
http://hl7.org/fhir/ValueSet/mimetypes,4.0.1,active,"2.16.840.1.113883.4.642.3.1024",Mime Types,MimeType,"This value set includes all possible codes from BCP-13 (http://tools.ietf.org/html/bcp13)","StructureDefinition/tiflow-diga-binary","Other"
http://hl7.org/fhir/ValueSet/performer-role,4.0.1,draft,"2.16.840.1.113883.4.642.3.433",ProcedurePerformerRoleCodes,Procedure Performer Role Codes,"This example value set defines the set of codes that can be used to indicate a role of a procedure performer.","StructureDefinition/tiflow-diga-task","SCT"
http://hl7.org/fhir/ValueSet/request-priority,4.0.1,draft,"2.16.840.1.113883.4.642.3.115",RequestPriority,Request priority,"The clinical priority of a diagnostic order.","StructureDefinition/GEM-ERP-PR-Communication-DiGA,StructureDefinition/tiflow-diga-task","hl7.fhir.r4.core"
http://hl7.org/fhir/ValueSet/resource-types,4.0.1,active,"2.16.840.1.113883.4.642.3.27",ResourceType,ResourceType,"One of the resource types defined as part of this version of FHIR.","StructureDefinition/GEM-ERP-PR-Communication-DiGA,StructureDefinition/GEM-ERP-PR-MedicationDispense-DiGA,StructureDefinition/tiflow-diga-receipt-composition,StructureDefinition/tiflow-diga-task","hl7.fhir.r4.core"
http://hl7.org/fhir/ValueSet/search-entry-mode,4.0.1,active,"2.16.840.1.113883.4.642.3.622",SearchEntryMode,SearchEntryMode,"Why an entry is in the result set - whether it's included as a match or because of an _include requirement, or to convey information or warning information about the search process.","StructureDefinition/tiflow-diga-receipt-bundle","hl7.fhir.r4.core"
http://hl7.org/fhir/ValueSet/security-labels,4.0.1,active,"2.16.840.1.113883.4.642.3.47",All Security Labels,SecurityLabels,"A single value set for all security labels defined by FHIR.","StructureDefinition/GEM-ERP-PR-MedicationDispense-DiGA,StructureDefinition/tiflow-diga-task",
http://hl7.org/fhir/ValueSet/task-code,4.0.1,active,"2.16.840.1.113883.4.642.3.1396",TaskCode,Task Codes,"Codes indicating the type of action that is expected to be performed","StructureDefinition/tiflow-diga-task","hl7.fhir.r4.core"
http://hl7.org/fhir/ValueSet/task-intent,4.0.1,draft,"2.16.840.1.113883.4.642.3.1240",TaskIntent,TaskIntent,"Distinguishes whether the task is a proposal, plan or full order.","StructureDefinition/tiflow-diga-task","hl7.fhir.r4.core"
http://terminology.hl7.org/ValueSet/v3-ActCode,3.0.0,active,,ActCode,v3 Code System ActCode,"A code specifying the particular kind of Act that the Act-instance represents within its class.  Constraints:  The kind of Act (e.g. physical examination, serum potassium, inpatient encounter, charge financial transaction, etc.) is specified with a code from one of several, typically external, coding systems.  The coding system will depend on the class of Act, such as LOINC for observations, etc. Conceptually, the Act.code must be a specialization of the Act.classCode. This is why the structure of ActClass domain should be reflected in the superstructure of the ActCode domain and then individual codes or externally referenced vocabularies subordinated under these domains that reflect the ActClass structure. Act.classCode and Act.code are not modifiers of each other but the Act.code concept should really imply the Act.classCode concept. For a negative example, it is not appropriate to use an Act.code ""potassium"" together with and Act.classCode for ""laboratory observation"" to somehow mean ""potassium laboratory observation"" and then use the same Act.code for ""potassium"" together with Act.classCode for ""medication"" to mean ""substitution of potassium"". This mutually modifying use of Act.code and Act.classCode is not permitted.","StructureDefinition/tiflow-diga-receipt-composition","THO (V3)"
http://terminology.hl7.org/ValueSet/v3-ActPharmacySupplyType,3.0.0,active,"2.16.840.1.113883.1.11.16208",ActPharmacySupplyType,ActPharmacySupplyType,"Identifies types of dispensing events","StructureDefinition/GEM-ERP-PR-MedicationDispense-DiGA","THO (V3)"
http://terminology.hl7.org/ValueSet/v3-ActSubstanceAdminSubstitutionCode,3.0.0,active,"2.16.840.1.113883.1.11.16621",ActSubstanceAdminSubstitutionCode,ActSubstanceAdminSubstitutionCode,"***No description***","StructureDefinition/GEM-ERP-PR-MedicationDispense-DiGA","THO (V3)"
http://terminology.hl7.org/ValueSet/v3-ConfidentialityClassification,2014-03-26,active,"2.16.840.1.113883.1.11.10228",v3.ConfidentialityClassification,V3 Value SetConfidentialityClassification," Set of codes used to value Act.Confidentiality and Role.Confidentiality attribute in accordance with the definition for concept domain ""Confidentiality"".","StructureDefinition/tiflow-diga-receipt-composition","THO (V3)"
http://terminology.hl7.org/ValueSet/v3-ParticipationMode,3.0.0,active,"2.16.840.1.113883.1.11.16543",ParticipationMode,ParticipationMode,"Identifies the primary means by which an Entity participates in an Act.","StructureDefinition/GEM-ERP-PR-Communication-DiGA","THO (V3)"
http://terminology.hl7.org/ValueSet/v3-SubstanceAdminSubstitutionReason,3.0.0,active,"2.16.840.1.113883.1.11.19377",SubstanceAdminSubstitutionReason,SubstanceAdminSubstitutionReason,"***No description***","StructureDefinition/GEM-ERP-PR-MedicationDispense-DiGA","THO (V3)"
https://gematik.de/fhir/erp/CodeSystem/GEM_ERP_VS_DocumentType,2.0.0-ballot.2,active,,GEM_ERP_VS_DocumentType,ValueSet der Dokumenttyp-Codes,"Art der Dokumente je nach Empfänger.","StructureDefinition/tiflow-diga-receipt-composition,StructureDefinition/tiflow-diga-task","de.gematik.tiflow"
https://gematik.de/fhir/erp/ValueSet/GEM_ERP_VS_FlowType,2.0.0-ballot.2,active,,GEM_ERP_VS_FlowType,ValueSet der Flowtypes in TIFlow Anwendungen,"Zeigt die verschiedenen Typen der TI Workflows entsprechend der Verordnungsformulare.","StructureDefinition/ti-flow-di-ga-create-operation-input","de.gematik.tiflow"
https://gematik.de/fhir/tiflow-diga/ValueSet/tiflow-diga-task-organizations-vs,2.0.0-ballot.2,active,,TIFlowDiGATaskOrganizationsVS,Bearbeiter eines E-Rezeptes,"ValueSet der Organisationstyp-Codes eines Performers für den DiGA Task","StructureDefinition/tiflow-diga-task","Other"
https://gematik.de/fhir/tiflow/ValueSet/tiflow-order-task-status-vs,2.0.0-ballot.2,draft,,TIFlowOrderTaskStatusVS,TIFlow Order Task ValueSet,"TIFlow Order Task ValueSet","StructureDefinition/tiflow-diga-task","hl7.fhir.r4.core"
